{
  "meta": {
    "number": 2,
    "name": "坤",
    "pinyin": "kūn",
    "fullName": "坤为地",
    "upperTrigram": "坤",
    "lowerTrigram": "坤"
  },
  "seo": {
    "title": "坤卦详解：坤为地，厚德载物",
    "description": "坤卦九步解读：纯阴承载，顺承乾元。读懂牝马之贞、黄裳元吉、用六利永贞，以及坤道如何成物载物。",
    "keywords": ["坤卦", "坤为地", "易经", "黄裳元吉", "厚德载物", "牝马之贞"]
  },
  "guaci": "坤：元亨，利牝马之贞。君子有攸往，先迷后得主，利西南得朋，东北丧朋。安贞，吉。",
  "hero": {
    "scene": "上下皆坤，地叠于地。大地不开口，却默默承受、化育、成全万物",
    "tagline": "顺承而不卑弱，厚载所以能成其大",
    "hexagramLines": [0, 0, 0, 0, 0, 0]
  },
  "steps": {
    "guanxiang": {
      "scene": "坤卦上坤下坤，纯阴六爻，像大地重叠、原野无尽。乾是发动之始，坤是承接之成。它不争先，不高鸣，却以容纳、承受、滋养，让万物真正落地。坤之伟大，不在炫目的创造，而在没有它，再好的种子也无处生长。",
      "imagery": "坤为地、为母、为众、为顺、为厚载。卦辞用“牝马”作喻极精确：马能行，牝马能顺而载，既不是瘫软静止，也不是刚猛争先，而是在顺承中保持恒常与耐力。所谓“先迷后得主”，不是叫人放弃判断，而是提醒坤道不能自作中心，只有找到所当承之道，才能成其功。",
      "essence": "坤卦的核心不是退让，而是承载；不是软弱，而是能容；不是没有方向，而是不以自我为轴，故能配天而成物。乾讲“创始”，坤讲“使创始变成现实”。"
    },
    "dutuan": {
      "tuanText": "至哉坤元，万物资生，乃顺承天。坤厚载物，德合无疆。含弘光大，品物咸亨。牝马地类，行地无疆。柔顺利贞，君子攸行。先迷失道，后顺得常。西南得朋，乃与类行；东北丧朋，乃终有庆。安贞之吉，应地无疆。",
      "cards": [
        {
          "label": "顺承乾元",
          "text": "万物资生，乃顺承天",
          "explain": "坤不是第二等原则，而是让乾的创始真正成物。没有坤的承接，乾的发动只停留在理念层。"
        },
        {
          "label": "牝马之贞",
          "text": "牝马地类，行地无疆",
          "explain": "彖传不用牛而用牝马，强调坤不是静止的顺，而是有方向、有耐力、能负重远行的顺。"
        },
        {
          "label": "后顺得常",
          "text": "先迷失道，后顺得常",
          "explain": "坤道一旦把自己当中心就会迷失；一旦回到所承之道，反而能得其常，长久成事。"
        }
      ],
      "insight": "坤卦最容易被误读成“逆来顺受”。其实它讲的是一种极高的成事能力：先识其主、再安其位、厚其载、成其终。顺不是没有立场，而是知道自己所配合的究竟是什么。",
      "source": "classic"
    },
    "xunzi": [
      {
        "char": "坤",
        "glyph": "地气舒展、广大而顺之象",
        "originalMeaning": "地、柔顺、承载",
        "extension": "在本卦里，“坤”不是被动消极，而是以柔顺之德承载万物，使其有生有成。",
        "shuowenRef": "古义多以地道、顺承、柔厚为本",
        "source": "classic"
      },
      {
        "char": "牝",
        "glyph": "从牛从匕，指雌性之属",
        "originalMeaning": "雌、母、能育",
        "extension": "卦辞言“牝马之贞”，重的不是性别，而是顺而能行、柔而能载、久而不失其途。",
        "shuowenRef": "传统训释多以雌性、母性为本义",
        "source": "classic"
      },
      {
        "char": "顺",
        "glyph": "循理而行，不逆其势",
        "originalMeaning": "依势、依理、顺承",
        "extension": "坤之顺不是讨好外界，而是顺天理、顺位置、顺所承之道，所以能“后顺得常”。",
        "shuowenRef": "今义与古义都强调随理而行",
        "source": "ai-analysis"
      },
      {
        "char": "黄",
        "glyph": "中央土色，中和之象",
        "originalMeaning": "中色、正色",
        "extension": "六五“黄裳”之吉，不在华美，而在中位之德外见于衣，象征中和、稳重、不过分。",
        "shuowenRef": "五行配土，土色为黄，故常表中和",
        "source": "classic"
      },
      {
        "char": "贞",
        "glyph": "问而守正之义",
        "originalMeaning": "正、定、守其常",
        "extension": "坤卦从卦辞到用六都反复落到“贞”。柔顺若无贞，只会流为软弱；有贞，才能把柔厚变成长期的力量。",
        "shuowenRef": "古义兼有卜问与守正之义，后者为本卦重点",
        "source": "classic"
      }
    ],
    "xiwei": {
      "overview": "坤卦六爻皆阴，是最纯粹的承载结构。纯阴并不代表平均用力，关键仍在时与位：六二居下卦中位，最能体现“直方大”；六五居尊位，以“黄裳”见其中德；初六与上六分别是阴气初凝与阴极疑阳，两端最值得警惕。",
      "yaoAnalysis": [
        {
          "position": "初六",
          "yinYang": "yin",
          "isProper": false,
          "traits": ["阳位", "不当位", "初位", "阴气始凝", "慎微"],
          "note": "初六阴居阳位，不当位而在最下，是阴势初起之处。其重点不在已成之恶，而在“履霜”所示的渐积之机。坤卦的警觉从最微处开始。"
        },
        {
          "position": "六二",
          "yinYang": "yin",
          "isProper": true,
          "traits": ["阴位", "当位", "下卦中位", "得中", "地道之纯"],
          "note": "六二阴居阴位，又在下卦中位，是坤德最纯的一爻。“直方大”不是技巧，而是内外方正、宽厚而不偏私，所以不习亦无不利。"
        },
        {
          "position": "六三",
          "yinYang": "yin",
          "isProper": false,
          "traits": ["阳位", "不当位", "人位", "含章", "从事不居功"],
          "note": "六三在下卦之上，阴居阳位，不当位，开始进入人事与功业层面。它最可贵处在“含章”，有文采而不自见，从王事而无成名之心，故能有终。"
        },
        {
          "position": "六四",
          "yinYang": "yin",
          "isProper": true,
          "traits": ["阴位", "当位", "上卦之始", "近尊位", "慎默"],
          "note": "六四阴居阴位，当位而近上。此位最忌多言妄动，所以“括囊”。不是消极闭塞，而是在复杂局面里守口守界，不给自己招祸。"
        },
        {
          "position": "六五",
          "yinYang": "yin",
          "isProper": false,
          "traits": ["阳位", "不当位", "上卦中位", "尊位", "中和"],
          "note": "六五虽阴居阳位而不当位，但居上卦中位，为尊位。坤在尊位不以强示人，而以“黄裳”见其德：居中守正，柔而有主，因此元吉。"
        },
        {
          "position": "上六",
          "yinYang": "yin",
          "isProper": true,
          "traits": ["阴位", "当位", "极位", "阴极疑阳", "穷极"],
          "note": "上六阴居阴位，形式上当位，但已到极位。坤德贵顺，到了上六却变成“龙战于野”，说明柔若走到极端，同样会与阳争而失其本。"
        }
      ],
      "keyInsight": "坤卦真正的结构重点，是在纯阴之中分清“承载”与“争胜”的边界。六二、六五是坤德之正面，初六、上六是坤道之戒线。厚，不等于无界；顺，不等于失贞。"
    },
    "wanci": {
      "trendData": [
        {"position": "初六", "level": "warn", "value": 38},
        {"position": "六二", "level": "safe", "value": 86},
        {"position": "六三", "level": "turn", "value": 68},
        {"position": "六四", "level": "warn", "value": 52},
        {"position": "六五", "level": "climax", "value": 93},
        {"position": "上六", "level": "danger", "value": 20}
      ],
      "yao": [
        {
          "position": "初六",
          "yaoci": "履霜，坚冰至。",
          "xiangYue": "象曰：履霜坚冰，阴始凝也。驯致其道，至坚冰也。",
          "wenyan": "臣弑其君，子弑其父，非一朝一夕之故，其所由来者渐矣。",
          "interpretation": "坤卦起手就不是宏大叙事，而是细微征兆。脚下只是霜，真正到来的却可能是坚冰。坤道最怕纵容小阴渐积，到最后势成难返。很多败局都不是突然崩坏，而是从“这点小问题无所谓”开始。",
          "level": "warn",
          "source": "classic"
        },
        {
          "position": "六二",
          "yaoci": "直，方，大，不习无不利。",
          "xiangYue": "象曰：六二之动，直以方也。不习无不利，地道光也。",
          "wenyan": "君子敬以直内，义以方外，敬义立而德不孤。",
          "interpretation": "六二是坤卦最漂亮的一爻。直，是内心正；方，是处事有界；大，是容量宽广。这样的人不靠花巧和机变，也能行得通。坤德真正的力量，不在机灵，而在稳、正、厚。",
          "level": "safe",
          "isHighlight": true,
          "highlightLabel": "坤德之纯",
          "source": "classic"
        },
        {
          "position": "六三",
          "yaoci": "含章可贞。或从王事，无成有终。",
          "xiangYue": "象曰：含章可贞，以时发也。或从王事，知光大也。",
          "wenyan": "阴虽有美，含之以从王事；弗敢成也。地道也，臣道也。",
          "interpretation": "六三进入做事层面，关键不是有没有才能，而是肯不肯把才能收住。含章不是压抑自己，而是不抢风头、不争首功。坤能有终，往往就赢在“成事而不居成”。",
          "level": "turn",
          "source": "classic"
        },
        {
          "position": "六四",
          "yaoci": "括囊；无咎，无誉。",
          "xiangYue": "象曰：括囊无咎，慎不害也。",
          "interpretation": "到了六四，位置已经靠近中枢，言行稍有不慎就会惹祸。所以这一爻教的不是表达，而是收束。无咎无誉，看似平淡，其实是高风险位置上的最好结果。",
          "level": "warn",
          "source": "classic"
        },
        {
          "position": "六五",
          "yaoci": "黄裳，元吉。",
          "xiangYue": "象曰：黄裳元吉，文在中也。",
          "wenyan": "君子黄中通理，正位居体，美在其中而畅于四支。",
          "interpretation": "黄裳之吉，正在一个“中”字。居尊位而不以锋芒压人，反以中和、分寸、稳重来成其事。坤到六五，不靠强势治理，而靠让秩序自然安定下来。",
          "level": "climax",
          "isHighlight": true,
          "highlightLabel": "黄中通理",
          "source": "classic"
        },
        {
          "position": "上六",
          "yaoci": "龙战于野，其血玄黄。",
          "xiangYue": "象曰：龙战于野，其道穷也。",
          "interpretation": "坤走到上六，纯阴不再是柔顺，而开始疑阳争阳。于是本来属于乾象的“龙”也被逼出来，终至相战。玄黄杂血，正说明天地秩序被搅乱。柔德一旦过头，同样会变成灾难。",
          "level": "danger",
          "source": "classic"
        }
      ],
      "yongjiu": {
        "text": "用六：利永贞。",
        "interpretation": "坤卦最后不再讲某一爻，而是讲纯坤之总原则：守其长久之贞。坤所有的美德，若不能长期守住，最终都可能滑向上六之争。"
      }
    },
    "chabian": {
      "xugua": {
        "text": "有天地，然后万物生焉。乾之后受之以坤，创始之后必须有承载，万物方有立足之地。",
        "chain": [
          {"name": "乾", "desc": "天道创始", "type": "past"},
          {"name": "坤", "desc": "地道承载", "type": "present"},
          {"name": "屯", "desc": "万物始生", "type": "future"}
        ]
      },
      "zagua": "杂卦传曰“乾刚坤柔”。这一“柔”不是弱，而是有容、有顺、有成。乾开其端，坤竟其事，二者相反而相成。",
      "zonggua": {
        "name": "坤（第2卦）",
        "comparison": "坤卦翻转仍为坤卦，与乾一样是自己的综卦。说明纯坤之德，不因角度变化而改其本质：无论怎么看，它都是承载与顺受。"
      },
      "cuogua": {
        "name": "乾（第1卦）",
        "comparison": "坤卦六爻反转即乾卦。乾与坤不是敌对废彼，而是宇宙结构中最基本的一对互补：一个开创，一个成物。"
      },
      "hugua": {
        "name": "坤（第2卦）",
        "meaning": "坤的互卦仍是坤。取其内部结构，依旧是纯阴纯地，说明坤的内外一致性极强，表里如一。"
      },
      "trajectory": "乾与坤合，天地定位；坤之后才有屯，表示承载不是结尾，而是后续万物生长的前提。所有真正的开始，都要先有能承受它的土壤。"
    },
    "guide": {
      "jiude": "坤德近于“敬以直内，义以方外”",
      "jiudeMeaning": "坤卦没有喧哗的英雄主义，它要求人把内在做正，把外在做稳，把容量做大，把位置守住。",
      "virtues": [
        {"icon": "厚", "name": "厚载", "description": "能容人、容事、容过程，不因眼前烦难而轻易翻桌。"},
        {"icon": "顺", "name": "顺理", "description": "顺的不是人情压力，而是更大的道理与时势。"},
        {"icon": "守", "name": "安贞", "description": "不乱动、不乱争，在自己的位上把事情做稳。"},
        {"icon": "终", "name": "有终", "description": "不抢开头的风光，重视结局能不能善成。"}
      ],
      "principle": "坤卦教人的不是“退一步海阔天空”，而是“把自己变成可以承事、承人、承压、承时的大地”。没有这种厚度，再好的理想都落不了地。"
    },
    "zhengyin": [
      {
        "yao": "初六",
        "event": "周幽王失政，祸由渐积",
        "source": "《史记·周本纪》",
        "detail": "西周之亡并非一日而成，而是礼坏乐崩、宠褒姒、废嫡立庶等问题层层积累，等到犬戎入侵时，坚冰已至。初六提醒的正是这种“从霜到冰”的渐变逻辑。",
        "contentSource": "classic"
      },
      {
        "yao": "六二",
        "event": "萧何守关中",
        "source": "《史记·萧相国世家》",
        "detail": "刘邦西入关中后，萧何不争战功，专做户籍、粮道、法度、仓储等基础工作。看似不显，实则“直方大”，没有这些承载，汉家难成规模。",
        "contentSource": "ai-analysis"
      },
      {
        "yao": "六三",
        "event": "姜尚辅周而不居王位",
        "source": "《史记·齐太公世家》",
        "detail": "太公望有定天下之功，却始终以臣辅主，不争名位。六三“从王事，无成有终”，讲的正是有才而能含章，把功业完成在体系之内。",
        "contentSource": "classic"
      },
      {
        "yao": "六四",
        "event": "曾国藩慎言自保",
        "source": "《清史稿·曾国藩传》",
        "detail": "位高而多疑的环境里，曾国藩始终节制言语与锋芒，能不抢先就不抢先。六四“括囊”不是怯懦，而是在险处懂得收口守界。",
        "contentSource": "ai-analysis"
      },
      {
        "yao": "六五",
        "event": "文景之治的中和之政",
        "source": "《史记·孝文本纪》《汉书·景帝纪》",
        "detail": "汉文、景两朝少用苛烈，重在休养生息、减赋薄徭，政治风格近“黄裳元吉”。不以强刺激求速效，反而养出长久国力。",
        "contentSource": "ai-analysis"
      },
      {
        "yao": "上六",
        "event": "吕后晚年宗族专政",
        "source": "《史记·吕太后本纪》",
        "detail": "本来以母后之位摄政，若守坤德尚可；一旦宗族权力坐大、阴势过极，便与正常秩序相战。上六之戒，正是在“柔而失贞”之后的反噬。",
        "contentSource": "ai-analysis"
      }
    ],
    "yingshe": [
      {
        "yao": "初六",
        "scenario": "团队里已经连续出现几次小范围失信、拖延和甩锅",
        "actionAdvice": "不要拿“问题不大”安慰自己。先把最小的坏苗头处理掉，否则后面要付出成倍成本。",